{
  "schema_version": "1.0",
  "kind": "sol-change/run",
  "id": "synthetic-research-candidate",
  "designation": "candidate",
  "input": "Research whether a small public library should pilot a lending collection of home energy monitors. Summarize benefits, limitations, and a practical pilot plan with source support.",
  "output": "RESEARCH BRIEF · Library energy monitor pilot\n\nRecommendation: run a six-week lending pilot with ten plug-in monitors.\n\nBenefits: help patrons understand appliance energy use and identify avoidable consumption.\n\nEvidence: 46 of 50 factual claims are supported in the imaginary source packet [citation-audit]. Four claims remain unsupported.\n\nLimitations: plug-in monitors cannot assess hardwired appliances; findings depend on usage habits. Savings are not guaranteed.\n\nPilot: track loans, returns, device failures, and patron feedback. Review usefulness with a librarian before adoption.",
  "configuration": {
    "verification_pass": true,
    "temperature": 0.2,
    "max_output_tokens": 1800
  },
  "workflow_version": "research-agent/2.0 (synthetic)",
  "executed_at": "2026-10-15T14:05:00Z",
  "conditions": {
    "task_id": "library-energy-pilot",
    "source_packet": "frozen-library-packet/1",
    "environment": "invented demo",
    "seed": 7
  },
  "data_type": "synthetic",
  "measurements": [
    {
      "criterion_id": "citation_support",
      "value": 92,
      "unit": "%",
      "method": {
        "kind": "automated_assessment",
        "description": "Supported factual claims divided by 50 claims, using the same frozen source packet and rubric.",
        "version": "claim-audit/1"
      },
      "evidence_ids": [
        "citation-audit"
      ]
    },
    {
      "criterion_id": "duration",
      "value": 112,
      "unit": "s",
      "method": {
        "kind": "measured",
        "description": "Wall-clock elapsed time from task submission to final output.",
        "version": "timer/1"
      },
      "evidence_ids": [
        "trace"
      ]
    },
    {
      "criterion_id": "cost",
      "value": 0.38,
      "unit": "USD",
      "method": {
        "kind": "measured",
        "description": "Input and output token charges summed using a frozen price table.",
        "version": "cost-ledger/1"
      },
      "evidence_ids": [
        "usage"
      ]
    },
    {
      "criterion_id": "usefulness",
      "value": null,
      "unit": "rating/5",
      "method": {
        "kind": "human_rating",
        "description": "One reviewer rates clarity and actionability from 1 to 5 using the pilot rubric.",
        "version": "reader-rubric/1"
      },
      "evidence_ids": []
    }
  ],
  "evidence": [
    {
      "id": "citation-audit",
      "title": "Claim-to-source audit",
      "reference": "synthetic://library-pilot/claim-audit",
      "provenance": "Invented fixture: 50 claims reviewed against an imaginary source packet. No real sources were audited."
    },
    {
      "id": "trace",
      "title": "Execution trace",
      "reference": "synthetic://library-pilot/execution-trace",
      "provenance": "Invented timings for demonstrating a latency tradeoff; not a captured execution trace."
    },
    {
      "id": "usage",
      "title": "Token usage ledger",
      "reference": "synthetic://library-pilot/usage",
      "provenance": "Invented USD cost; not an invoice or provider billing record."
    },
    {
      "id": "reader-rubric",
      "title": "Reader evaluation rubric",
      "reference": "synthetic://library-pilot/reader-rubric",
      "provenance": "Invented baseline rating. Candidate review deliberately missing."
    }
  ]
}
